{
  "$schema": "./agentaz.schema.json",
  "version": "2.0.0",
  "last_reviewed": "2026-06-24",
  "agent_id": "resume-screening-agent",
  "trust_level": "A2",
  "dna_pattern": "Evaluation",
  "worst_case_action": "Produces a biased/incorrect assessment for recruiter review. Cannot reject, advance, or contact candidates.",
  "authority_boundary": "Assesses resumes against job-relevant criteria for human review; decision/contact tools absent.",
  "tags": [
    "hr",
    "recruiting",
    "resume-screening",
    "fairness",
    "human-review"
  ],
  "tool_boundary": {
    "allowed_tools": [
      "read_resume",
      "match_criteria",
      "summarize_fit",
      "flag_for_review"
    ],
    "execution_tools_absent": true
  },
  "output_boundary": {
    "format": "structured_json",
    "never_emits": [
      "reject",
      "advance",
      "contact_candidate",
      "hiring_decision"
    ],
    "excludes_protected_characteristics": true
  },
  "cost_boundary": {
    "max_usd_per_trace_loop": 0.22,
    "alert_threshold_usd": 0.15
  },
  "loop_boundary": {
    "max_reasoning_turns": 8
  },
  "human_handoff": {
    "triggers": [
      "borderline_fit",
      "insufficient_info",
      "low_confidence"
    ],
    "destination": "recruiter"
  },
  "audit": {
    "append_only": true,
    "logs": [
      "assessment",
      "criteria_used"
    ]
  }
}
