{
  "$schema": "./agentaz.schema.json",
  "version": "2.0.0",
  "last_reviewed": "2026-06-24",
  "agent_id": "community-triage-agent",
  "trust_level": "A2",
  "dna_pattern": "Escalation",
  "worst_case_action": "Misroutes a question or drafts a wrong answer, caught before post. Cannot post or moderate.",
  "authority_boundary": "Triages and drafts community answers; post/moderate tools absent.",
  "tags": [
    "community",
    "triage",
    "read-only",
    "human-review"
  ],
  "tool_boundary": {
    "allowed_tools": [
      "read_question",
      "classify",
      "draft_answer",
      "route"
    ],
    "execution_tools_absent": true
  },
  "output_boundary": {
    "format": "structured_json",
    "never_emits": [
      "post",
      "send",
      "moderate"
    ]
  },
  "cost_boundary": {
    "max_usd_per_trace_loop": 0.18,
    "alert_threshold_usd": 0.12
  },
  "loop_boundary": {
    "max_reasoning_turns": 6
  },
  "human_handoff": {
    "triggers": [
      "sensitive_topic",
      "low_confidence"
    ],
    "destination": "moderator"
  },
  "audit": {
    "append_only": true,
    "logs": [
      "classification",
      "drafts"
    ]
  }
}
