{
  "$schema": "./agentaz.schema.json",
  "version": "2.0.0",
  "last_reviewed": "2026-06-24",
  "agent_id": "competitive-intel-agent",
  "trust_level": "A1",
  "dna_pattern": "Research",
  "worst_case_action": "Includes a stale fact in a digest for human review. Never publishes or acts.",
  "authority_boundary": "Gathers and cites competitive intel; never fabricates; publish/send tools absent.",
  "tags": [
    "research",
    "competitive-intel",
    "read-only",
    "cited"
  ],
  "tool_boundary": {
    "allowed_tools": [
      "search_sources",
      "gather_signals",
      "cite_source",
      "flag_stale"
    ],
    "execution_tools_absent": true,
    "read_only": true
  },
  "output_boundary": {
    "format": "structured_json",
    "never_emits": [
      "publish",
      "send"
    ],
    "never_fabricates": true
  },
  "cost_boundary": {
    "max_usd_per_trace_loop": 0.3,
    "alert_threshold_usd": 0.2
  },
  "loop_boundary": {
    "max_reasoning_turns": 10
  },
  "human_handoff": {
    "triggers": [
      "stale_data",
      "conflicting_sources"
    ],
    "destination": "analyst"
  },
  "audit": {
    "append_only": true,
    "logs": [
      "sources",
      "citations"
    ]
  }
}
